{
  "title": "A → B → C",
  "viewport": { "height": 280, "padding": 50 },
  "nodes": [
    { "id": "a", "type": "port", "role": "source", "shape": "circle", "icon": "log-in", "x": 120, "y": 140 },
    { "id": "b", "type": "process", "label": "Processo", "icon": "cog", "duration": 700, "x": 320, "y": 140 },
    { "id": "c", "type": "port", "role": "terminal", "label": "Saída", "icon": "log-out", "tone": "success", "x": 520, "y": 140 }
  ],
  "edges": [
    { "id": "ab", "from": "a", "to": "b" },
    { "id": "bc", "from": "b", "to": "c" }
  ],
  "sources": [{ "edge": "ab", "interval": 2200, "token": { "color": "#7C3AED", "speed": 90 } }]
}
