{
  "title": "RAG pipeline",
  "viewport": { "height": 320, "padding": 50 },
  "nodes": [
    { "id": "query", "type": "port", "role": "source", "label": "Query", "shape": "circle", "icon": "search", "x": 70, "y": 160 },
    { "id": "embed", "type": "process", "label": "Embed", "icon": "binary", "duration": 500, "x": 200, "y": 160 },
    { "id": "retrieve", "type": "process", "label": "Retrieve", "icon": "database", "duration": 900, "x": 340, "y": 160 },
    { "id": "rerank", "type": "process", "label": "Rerank", "icon": "list-ordered", "duration": 600, "x": 480, "y": 160, "tone": "warning" },
    { "id": "llm", "type": "process", "label": "LLM", "icon": "brain", "duration": 1800, "x": 620, "y": 160, "tone": "primary" },
    { "id": "answer", "type": "port", "role": "terminal", "label": "Answer", "icon": "message-circle", "tone": "success", "x": 760, "y": 160 }
  ],
  "edges": [
    { "id": "e1", "from": "query", "to": "embed" },
    { "id": "e2", "from": "embed", "to": "retrieve" },
    { "id": "e3", "from": "retrieve", "to": "rerank" },
    { "id": "e4", "from": "rerank", "to": "llm" },
    { "id": "e5", "from": "llm", "to": "answer", "stroke": { "color": "success" } }
  ],
  "sources": [{ "edge": "e1", "interval": 4500 }]
}
