{
  "title": "Catálogo visual v1",
  "viewport": { "height": 380, "padding": 55 },
  "nodes": [
    { "id": "src", "type": "port", "role": "source", "shape": "circle", "icon": "circle", "x": 90, "y": 190 },
    { "id": "rect", "type": "process", "label": "Rect + label", "icon": "box", "duration": 500, "x": 240, "y": 120,
      "pillTop": [{ "text": "config", "tone": "primary" }] },
    { "id": "circ", "type": "process", "shape": "circle", "icon": "zap", "duration": 350, "x": 240, "y": 260, "tone": "warning" },
    { "id": "hub", "type": "process", "label": "Split", "icon": "git-merge", "duration": 400, "x": 420, "y": 190,
      "emit": { "mode": "all" } },
    { "id": "sink", "type": "port", "role": "sink", "label": "Sink", "icon": "check", "tone": "success", "x": 600, "y": 190, "showReceived": true }
  ],
  "edges": [
    { "id": "e1", "from": "src", "to": "rect", "stroke": { "dash": "dash" } },
    { "id": "e2", "from": "src", "to": "circ", "label": { "text": "fast path" }, "stroke": { "color": "warning", "dash": "dash" } },
    { "id": "e3", "from": "rect", "to": "hub" },
    { "id": "e4", "from": "circ", "to": "hub" },
    { "id": "e5", "from": "hub", "to": "sink", "stroke": { "color": "success", "width": 2.5 }, "label": { "text": "out" } }
  ],
  "sources": [
    { "edge": "e1", "interval": 2800, "token": { "color": "#7C3AED" } },
    { "edge": "e2", "interval": 3600, "token": { "shape": "rect", "color": "#D97706", "size": 6 } }
  ]
}
